Υπηρεσία;Κ.Α.;Περιγραφή;Προϋπολογισθέντα;Διαμορφωθέντα;Βεβαιωθέντα;Εισπραχθέντα;
;0111.01.01;ΜΙΣΘΩΜΑΤΑ ΑΠΟ ΑΝΘΟΠΩΛΕΙΑ ΝΕΩΝ ΚΟΙΜΗΤΗΡΙΩΝ;128.000,00;128.000,00;117.185,20;117.185,20;
;0111.01.02;ΜΙΣΘΩΜΑΤΑ ΑΠΟ ΑΙΘΟΥΣΕΣ ΔΕΞΙΩΣΕΩΝ ΝΕΩΝ ΚΟΙΜΗΤΗΡΙΩΝ;100.000,00;100.000,00;18.775,00;18.775,00;
;0111.02.02;ΜΙΣΘΩΜΑΤΑ ΑΠΟ ΑΝΑΨΥΚΤΗΡΙΟ ΠΑΡΚΟΥ Ν.ΕΛΒΕΤΙΑΣ;50.000,00;50.000,00;26.518,30;0,00;
;0111.02.03;ΜΙΣΘΩΜΑΤΑ ΑΠΟ ΑΝΑΨΥΚΤΗΡΙΟ-ΚΥΛΙΚΕΙΟ ΠΑΡΚΟΥ ΑΝΘΟΚΟΜΙΚΗΣ;108.770,00;117.829,40;117.829,40;54.043,79;
;0111.02.06;ΜΙΣΘΩΜΑΤΑ ΑΠΟ ΑΝΑΨΥΚΤΗΡΙΟ-ΚΥΛΙΚΕΙΟ ΘΕΑΤΡΟΥ ΚΗΠΟΥ;5.500,00;5.500,00;3.750,00;3.750,00;
;0111.02.07;ΜΙΣΘΩΜΑΤΑ ΑΠΟ ΑΝΑΨΥΚΤΗΡΙΟ ΚΕΔΡΙΝΟΥ ΛΟΦΟΥ;100.000,00;100.000,00;62.782,50;0,00;
;0111.02.11;ΜΙΣΘΩΜΑΤΑ ΑΠΟ ΑΝΑΨΥΚΤΗΡΙΟ ΑΓΙΑΣ ΠΑΡΑΣΚΕΥΗΣ;5.000,00;5.000,00;5.000,00;2.500,00;
;0111.03.01;ΜΙΣΘΩΜΑΤΑ ΑΠΟ ΚΥΛΙΚΕΙΟ ΔΗΜΟΤ.ΑΚΙΝΗΤΟΥ ΠΑΠΑΡΗΓΟΠΟΥΛΟΥ;1.200,00;1.200,00;0,00;0,00;
;0111.03.04;ΜΙΣΘΩΜΑΤΑ ΑΠΟ ΚΥΛΙΚΕΙΑ ΚΤΙΡΙΑΚΟΥ ΣΥΓΚΡΟΤΗΜΑΤΟΣ ΤΟΥΜΠΑΣ;29.540,00;29.540,00;28.293,08;4.060,80;
;0111.03.05;ΜΙΣΘΩΜΑΤΑ ΑΠΟ ΚΥΛΙΚΕΙΑ ΝΕΟΥ ΔΗΜΑΡΧΙΑΚΟΥ ΜΕΓΑΡΟΥ;26.000,00;26.000,00;12.500,00;0,00;
;0111.04.02;ΜΙΣΘΩΜΑΤΑ ΑΠΟ ΚΑΤΑΣΤΗΜΑ ΟΔΟΥ ΑΣΚΗΤΟΥ;3.010,00;3.010,00;3.007,39;3.007,39;
;0111.04.05;ΜΙΣΘΩΜΑΤΑ ΑΠΟ ΚΑΤΑΣΤΗΜΑ ΟΔΟΥ  ΕΛΕΥΘΕΡΙΑΣ ΔΗΜΟΤΙΚΗΣ ΚΟΙΝΟΤΗΤΑΣ ΤΡΙΑΝΔΡΙΑΣ;12.000,00;12.484,64;12.484,64;12.484,64;
;0111.05.02;ΜΙΣΘΩΜΑΤΑ ΑΠΟ ΧΡΗΣΗ ΔΗΜΟΤΙΚΩΝ ΑΚΙΝΗΤΩΝ (Κ.ΚΑΡΑΜΑΝΛΗ 351);1.400,00;1.400,00;1.160,00;1.160,00;
;0111.05.03;ΜΙΣΘΩΜΑΤΑ ΑΠΟ ΥΠΟΚΑΤΑΣΤΗΜΑ ΤΡΑΠΕΖΑΣ ΣΤΟ ΔΗΜΑΡΧΙΑΚΟ ΜΕΓΑΡΟ;30.600,00;30.600,00;30.120,00;30.120,00;
;0111.05.04;ΜΙΣΘΩΜΑΤΑ ΑΠΌ ΕΚΜΙΣΘΩΣΗ ΧΩΡΟΥ ΒΙΛΛΑΣ ΜΟΡΝΤΩΧ;24.000,00;26.000,00;26.000,00;0,00;
;0111.06.01;ΜΙΣΘΩΜΑΤΑ ΑΠΟ ΠΕΡΙΠΤΕΡΟ ΠΟΛΙΤΙΣΜΟΥ &  ΑΝΑΨΥΧΗΣ ΠΑΡΚΟΥ ΝΕΡΟΥ ΣΤΗ Ν. ΠΑΡΑΛΙΑ;85.000,00;85.000,00;83.900,00;0,00;
;0111.06.02;ΜΙΣΘΩΜΑΤΑ ΑΠΟ ΑΦΟΔΕΥΤΗΡΙΑ;250,00;250,00;228,83;0,00;
;0114.01.01;ΜΙΣΘΩΜΑΤΑ ΑΠΟ ΔΗΜΟΤΙΚΗ ΑΓΟΡΑ ΒΑΡΔΑΡΙΟΥ (15 ΚΑΤΑΣΤΗΜΑΤΑ);38.000,00;38.000,00;34.326,24;21.846,24;
;0114.01.02;ΜΙΣΘΩΜΑΤΑ ΑΠΟ ΔΗΜΟΤΙΚΗ ΑΓΟΡΑ ΒΛΑΛΗ-ΣΟΛΩΜΟΥ (10 ΚΑΤΑΣΤΗΜΑΤΑ);19.300,00;19.300,00;12.353,27;5.712,44;
;0114.01.03;ΜΙΣΘΩΜΑΤΑ ΑΠΟ ΔΗΜΟΤΙΚΗ ΑΓΟΡΑ ΒΛΑΛΗ-ΑΣΚΗΤΟΥ (6 ΚΑΤΑΣΤΗΜΑΤΑ);5.200,00;6.034,76;6.034,76;3.785,12;
;0114.01.04;ΜΙΣΘΩΜΑΤΑ ΑΠΟ ΠΑΓΚΟΥΣ ΑΓΟΡΑΣ ΒΛΑΛΗ (15 ΠΑΓΚΟΙ);35.400,00;36.827,92;40.404,92;12.589,39;
;0115.01.02;ΑΠΟΖΗΜΙΩΣΗ ΧΡΗΣΗΣ ΑΠΟ ΤΗΝ ΠΑΡΑΧΩΡΗΣΗ ΚΟΙΝΟΧΡΗΣΤΩΝ ΧΩΡΩΝ ΓΙΑ ΣΤΕΓΑΣΤΡΑ ΟΑΣΘ;100.000,00;100.000,00;0,00;0,00;
;0122.01.01;ΤΕΛΗ ΑΠΟ ΥΠΑΙΘΡΙΟ ΕΜΠΟΡΙΟ ΣΤΑΣΙΜΟ ΚΑΙ ΠΛΑΝΟΔΙΟ;40.000,00;40.000,00;24.620,00;24.620,00;
;0122.01.02;ΤΕΛΗ ΑΠΟ ΕΜΠΟΡΟΠΑΝΗΓΥΡΕΙΣ-ΠΑΖΑΡΙΑ;18.000,00;30.500,00;32.580,00;32.580,00;
;0122.02.01;ΕΣΟΔΑ ΑΠΟ ΑΠΟΔΟΣΗ ΣΤΟ ΔΗΜΟ ΕΙΣΠΡΑΧΘΕΝΤΩΝ ΗΜΕΡΗΣΙΟΥ ΔΙΚΑΙΩΜΑΤΟΣ ΑΠΟ ΛΑΙΚΕΣ ΑΓΟΡΕΣ;350.000,00;350.000,00;0,00;0,00;
;0129.01.01;ΕΣΟΔΑ ΑΠΟ ΠΑΡΑΧΩΡΗΣΗ ΧΡΗΣΗΣ ΠΑΡΚΙΝΓΚ ΠΛΑΤΕΙΑΣ ΕΛΕΥΘΕΡΙΑΣ;1.210.000,00;1.210.000,00;1.301.083,29;1.301.083,29;
;0129.03.01;ΕΣΟΔΑ ΑΠΟ ΠΑΡΑΧΩΡΗΣΗ ΧΡΗΣΗΣ ΠΑΡΚΙΓΚ 26ης ΟΚΤΩΒΡΙΟΥ (ΒΑΡΔΑΡΙ);36.000,00;36.000,00;0,00;0,00;
;0129.04.01;ΑΠΟΖΗΜΙΩΣΗ ΧΡΗΣΗΣ ΑΠΌ ΠΑΡΑΧΩΡΗΣΗ ΚΟΙΝΟΧΡΗΣΤΟΥ ΧΩΡΟΥ ΓΙΑ ΕΝΟΙΚΙΑΣΗ ΠΟΔΗΛΑΤΩΝ;10.000,00;10.000,00;0,00;0,00;
;0129.06.01;ΜΙΣΘΩΜΑΤΑ ΑΠΟ ΣΧΟΛΑΖΟΝΤΑ ΠΕΡΙΠΤΕΡΑ - ΚΥΛΙΚΕΙΑ;150.000,00;194.267,10;194.267,10;93.202,32;
;0211.01.01;ΤΟΚΟΙ ΑΠΟ ΚΑΤΑΘΕΣΕΙΣ ΧΡΗΜΑΤΩΝ ΣΕ ΤΡΑΠΕΖΕΣ;500.000,00;500.000,00;337.400,28;337.400,28;
;0231.01.01;ΜΙΣΘΩΜΑΤΑ ΚΙΝΗΤΩΝ ΠΡΑΓΜΑΤΩΝ;2.000,00;2.000,00;1.239,00;1.239,00;
;0311.01.01;ΤΕΛΗ ΚΑΘΑΡΙΟΤΗΤΑΣ ΚΑΙ ΦΩΤΙΣΜΟΥ;40.000.000,00;40.000.000,00;37.384.148,76;37.376.020,38;
;0411.01.95;ΔΙΚΑΙΩΜΑ ΣΥΣΤΑΣΗΣ ΟΙΚΟΓΕΝΕΙΑΚΩΝ ΤΑΦΩΝ;100.000,00;100.000,00;92.370,00;92.370,00;
;0412.01.95;ΔΙΚΑΙΩΜΑΤΑ ΕΝΤΑΦΙΑΣΜΟΥ ΣΤΑ ΚΟΙΜΗΤΗΡΙΑ;1.150.000,00;1.531.700,00;1.650.865,00;1.544.127,39;
;0413.01.95;ΔΙΚΑΙΩΜΑ ΑΝΑΝΕΩΣΗΣ (ΠΑΡΑΤΑΣΗ ΤΑΦΗΣ) ΣΤΑ ΚΟΙΜΗΤΗΡΙΑ;620.000,00;677.658,90;704.858,65;692.123,86;
;0414.01.95;ΤΕΛΟΣ ΑΝΑΚΟΜΙΔΗΣ ΣΤΑ ΚΟΙΜΗΤΗΡΙΑ;120.000,00;122.667,00;130.217,00;129.656,00;
;0415.01.95;ΔΙΚΑΙΩΜΑΤΑ ΑΠΟ ΤΗ ΧΡΗΣΗ ΟΣΤΕΟΦΥΛΑΚΙΩΝ ΣΤΑ ΚΟΙΜΗΤΗΡΙΑ;250.000,00;250.882,50;282.182,50;281.487,06;
;0416.01.95;ΔΙΚΑΙΩΜΑΤΑ ΙΕΡΟΠΡΑΞΙΩΝ ΣΤΑ ΚΟΙΜΗΤΗΡΙΑ;290.000,00;296.279,00;317.046,00;296.161,43;
;0417.01.95;ΛΟΙΠΑ ΕΣΟΔΑ ΝΕΚΡΟΤΑΦΕΙΩΝ ΚΑΙ ΙΕΡΩΝ ΝΑΩΝ ΣΤΑ ΚΟΙΜΗΤΗΡΙΑ;200.000,00;200.000,00;202.913,08;198.207,44;
;0431.01.01;ΕΣΟΔΑ ΑΠΟ ΤΗ ΣΥΜΒΑΣΗ ΠΑΡΑΧΩΡΗΣΗΣ ΤΗΣ ΧΡΗΣΗΣ ΤΟΥ ΠΑΡΚΙΝΓΚ ΤΟΥ ΔΗΜΑΡΧΙΑΚΟΥ ΜΕΓΑΡΟΥ;40.000,00;45.184,84;45.184,84;0,00;
;0432.01.01;ΕΣΟΔΑ ΑΠΟ ΕΙΣΗΤΗΡΙΑ ΘΕΑΤΡΩΝ, ΚΙΝΗΜΑΤΟΓΡΑΦΩΝ, ΕΚΔΗΛΩΣΕΩΝ ΚΛΠ;20.000,00;20.000,00;0,00;0,00;
;0434.03.01;ΕΣΟΔΑ ΑΠΟ ΧΩΡΟΥΣ ΑΘΛΗΣΗΣ;223.577,23;223.577,23;164.740,57;164.740,57;
;0434.07.01;ΕΣΟΔΑ ΑΠΌ ΚΑΤΑΒΟΛΗ ΑΝΤΙΤΙΜΟΥ ΜΕΤΑΦΟΡΑΣ ΑΜΕΑ;2.500,00;2.500,00;1.998,00;1.998,00;
;0434.08.01;ΕΣΟΔΑ ΑΠΟ ΗΜΕΡΗΣΙΑ ΜΙΣΘΩΣΗ ΠΟΛΙΤΙΣΤΙΚΩΝ ΚΛΠ ΧΩΡΩΝ;16.300,00;26.383,10;26.946,35;26.946,35;
;0441.01.95;ΤΕΛΟΣ ΑΚΙΝΗΤΗΣ ΠΕΡΙΟΥΣΙΑΣ;4.900.000,00;4.750.000,00;5.055.336,62;5.054.759,11;
;0441.02.95;ΑΠΟ ΕΣΟΔΟ ΤΑΠ 15% ΥΠΕΡ ΤΟΥ ΕΙΔΙΚΟΥ ΛΟΓΑΡΙΑΣΜΟΥ ΤΠ&Δ (ΑΡΘ.24 ΠΑΡ. 19 Ν.2130/93);500.000,00;500.000,00;423.320,00;423.320,00;
;0451.01.01;ΤΕΛΗ ΔΙΑΜΟΝΗΣ ΠΑΡΕΠΙΔΗΜΟΥΝΤΩΝ;160.000,00;228.049,92;249.507,87;249.507,87;
;0452.01.01;ΤΕΛΟΣ 5% ΕΠΙ ΤΩΝ ΑΚΑΘΑΡΙΣΤΩΝ ΕΣΟΔΩΝ ΚΕΝΤΡΩΝ ΔΙΑΣΚΕΔΑΣΗΣ ΚΛΠ;60.000,00;60.000,00;56.970,63;56.970,63;
;0452.02.01;ΤΕΛΟΣ 0,5% ΕΠΙ ΤΩΝ ΑΚΑΘΑΡΙΣΤΩΝ ΕΣΟΔΩΝ ΚΕΝΤΡΩΝ ΔΙΑΣΚΕΔΑΣΗΣ ΚΛΠ;560.000,00;763.741,15;815.251,01;815.251,01;
;0461.01.01;ΤΕΛΗ ΧΡΗΣΗΣ ΚΟΙΝΟΧΡΗΣΤΩΝ ΧΩΡΩΝ ΓΙΑ ΘΑΛΑΜΟΥΣ ΚΑΡΤΟΤΗΛΕΦΩΝΩΝ ΟΤΕ;10.000,00;10.000,00;0,00;0,00;
;0461.03.01;ΤΕΛΗ ΧΡΗΣΗΣ ΠΕΖΟΔΡΟΜΙΩΝ & ΚΟΙΝΟΧΡΗΣΤΩΝ ΧΩΡΩΝ ΑΠΟ ΤΟΠΟΘΕΤΗΣΗ ΤΡΑΠΕΖΟΚΑΘΙΣΜΑΤΩΝ;1.250.000,00;1.469.629,05;1.565.768,27;1.553.090,97;
;0461.03.02;ΤΕΛΗ ΧΡΗΣΗΣ ΠΕΖΟΔΡΟΜΙΩΝ & ΚΟΙΝΟΧΡΗΣΤΩΝ ΧΩΡΩΝ ΑΠΟ ΠΕΡΙΠΤΕΡΑ;200.000,00;200.000,00;200.197,41;197.477,41;
;0461.03.03;ΤΕΛΗ ΧΡΗΣΗΣ ΠΕΖΟΔΡΟΜΙΩΝ & ΚΟΙΝΟΧΡΗΣΤΩΝ ΧΩΡΩΝ ΑΠΟ ΤΟΠΟΘΕΤΗΣΗ ΕΜΠΟΡΕΥΜΑΤΩΝ;350.000,00;350.000,00;283.895,18;283.592,38;
;0461.03.05;ΤΕΛΗ ΧΡΗΣΗΣ ΠΕΖΟΔΡΟΜΙΩΝ & ΚΟΙΝΟΧΡΗΣΤΩΝ ΧΩΡΩΝ ΑΠΟ ΤΟΠΟΘΕΤΗΣΗ ΟΙΚΟΔΟΜΙΚΩΝ ΥΛΙΚΩΝ - ΚΟΝΤΕΙΝΕΡ ΚΛΠ;25.000,00;41.359,04;43.935,82;43.935,82;
;0461.03.06;ΤΕΛΗ ΧΡΗΣΗΣ ΠΕΖΟΔΡΟΜΙΩΝ & ΚΟΙΝΟΧΡΗΣΤΩΝ ΧΩΡΩΝ ΑΠΟ ΔΙΑΦΟΡΕΣ ΔΡΑΣΤΗΡΙΟΤΗΤΕΣ;30.000,00;30.000,00;21.310,00;21.310,00;
;0461.04.01;ΤΕΛΗ ΧΡΗΣΗΣ ΥΠΕΔΑΦΟΥΣ ΑΠΌ ΤΕΛΗ ΔΙΕΛΕΥΣΗΣ ΟΠΤΙΚΩΝ ΙΝΩΝ;20.000,00;20.000,00;15.025,76;15.025,76;
;0462.01.01;ΤΕΛΗ ΔΙΑΦΗΜΙΣΗΣ ΣΤΕΓΑΣΤΡΩΝ ΤΟΥ ΟΑΣΘ;25.000,00;25.000,00;0,00;0,00;
;0462.01.02;ΤΕΛΗ ΔΙΑΦΗΜΙΣΗΣ ΛΕΩΦΟΡΕΙΩΝ ΤΟΥ ΟΑΣΘ & ΤΑΞΙ & ΟΧΗΜΑΤΩΝ ΔΗΜΟΣΙΑΣ ΧΡΗΣΗΣ;1.000,00;1.262,85;1.262,85;1.262,85;
;0462.01.04;ΤΕΛΗ ΔΙΑΦΗΜΙΣΗΣ ΑΠΟ ΠΕΡΙΠΤΕΡΑ;8.000,00;8.000,00;7.138,85;7.138,85;
;0462.01.06;ΤΕΛΗ ΔΙΑΦΗΜΙΣΗΣ ΑΠΟ ΓΗΠΕΔΑ;5.000,00;5.000,00;6.802,58;6.802,58;
;0462.01.07;ΤΕΛΗ ΔΙΑΦΗΜΙΣΗΣ ΑΠΟ ΔΙΑΦΟΡΕΣ ΠΕΡΙΠΤΩΣΕΙΣ;500,00;500,00;216,50;216,50;
;0464.01.95;ΤΕΛΗ ΕΛΕΓΧΟΜΕΝΗΣ ΣΤΑΘΜΕΥΣΗΣ ΣΕ ΚΟΙΝΟΧΡΗΣΤΟΥΣ ΧΩΡΟΥΣ (ΒΡΑΧΥΧΡΟΝΙΑ);45.000,00;21.144,02;4.136,99;4.136,99;
;0464.02.95;ΤΕΛΗ ΕΛΕΓΧΟΜΕΝΗΣ ΣΤΑΘΜΕΥΣΗΣ ΣΕ ΚΟΙΝΟΧΡΗΣΤΟΥΣ ΧΩΡΟΥΣ (ΜΑΚΡΟΧΡΟΝΙΑ-ΚΑΡΤΕΣ);70.000,00;146.730,00;133.054,52;133.054,52;
;0468.01.95;ΤΕΛΟΣ ΑΔΕΙΩΝ ΟΙΚΟΔΟΜΩΝ (ΑΡ.23 ΑΠΟ 24/9-20/10/1958 Β.Δ.);4.000,00;4.000,00;3.197,69;3.197,69;
;0469.03.95;ΕΙΔΙΚΟ ΤΕΛΟΣ 10% Ν.2364/95 ΑΡΘΡΟ 5 (Δ.ΕΠ.Α. ΑΕ) ΣΤΟ ΔΘ;386.500,00;386.500,00;348.925,58;348.925,58;
;0511.01.01;ΦΟΡΟΣ ΗΛΕΚΤΡΟΔΟΤΟΥΜΕΝΩΝ ΧΩΡΩΝ (άρθρ. 10 Ν 1080/80);6.000.000,00;6.000.000,00;5.715.646,68;5.714.676,76;
;0512.01.01;ΦΟΡΟΣ ΖΥΘΟΥ ΟΙΝΟΠΝΕΥΜΑΤΩΔΩΝ ΠΟΤΩΝ (άρθρ.9 ΝΔ 703/70, άρθρ. 12 Ν 1080/80);586.775,00;74.200,00;0,00;0,00;
;0521.01.95;ΕΙΣΦΟΡΑ ΣΕ ΧΡΗΜΑ (ΠΕΡΙΟΧΗ ΕΠΕΚΤ.ΚΗΦΙΣΙΑΣ) ΑΡΘ.9, Ν.1337/83;1.000,00;1.000,00;0,00;0,00;
;0521.02.95;ΕΙΣΦΟΡΑ ΣΕ ΧΡΗΜΑ ΑΠΟ ΠΕΡΙΟΧΗ ΕΠΕΚΤΑΣΗΣ ΤΡΟΧΙΟΔΡΟΜΙΚΩΝ ΧΑΡΙΛΑΟΥ Δ.Θ  ΑΡΘ.9, Ν.1337/83;2.000,00;2.000,00;0,00;0,00;
;0522.02.95;ΜΕΤΑΤΡΟΠΗ ΣΕ ΧΡΗΜΑ ΤΗΣ ΕΙΣΦΟΡΑΣ ΣΕ ΓΗ (ΕΠΕΚΤΑΣΗ ΣΧ.ΠΟΛΗΣ ΤΡΟΧΙΟΔΡΟΜΙΚΩΝ ΧΑΡΙΛΑΟΥ);4.000,00;4.000,00;0,00;0,00;
;0522.03.95;ΕΙΣΦΟΡΑ ΣΕ ΧΡΗΜΑ ΛΟΓΩ ΡΥΜΟΤ.ΙΔΙΟΚ. (ΑΡΘ.8, Ν.1337/83);1.000,00;1.000,00;60,00;60,00;
;0523.01.01;ΕΙΣΦΟΡΑ 40% ΤΟΥ ΚΗ/1947 ΨΗΦΙΣΜΑΤΟΣ ΓΙΑ ΤΗΝ ΕΚΔΟΣΗ ΟΙΚΟΔΟΜΙΚΗΣ ΑΔΕΙΑΣ;5.000,00;5.000,00;6.852,99;6.852,99;
;0527.01.01;ΕΣΟΔΑ ΑΠΟ ΤΡΟΦΕΙΑ ΔΗΜΟΤΙΚΩΝ ΠΑΙΔΙΚΩΝ - ΒΡΕΦΟΝΗΠΙΑΚΩΝ ΣΤΑΘΜΩΝ;401.334,93;527.769,00;528.044,00;500.174,73;
;0611.01.01;ΚΕΝΤΡΙΚΟΙ ΑΥΤΟΤΕΛΕΙΣ ΠΟΡΟΙ ΓΙΑ ΤΗΝ ΚΑΛΥΨΗ ΛΕΙΤΟΥΡΓΙΚΩΝ ΔΑΠΑΝΩΝ;33.376.482,14;33.376.482,14;32.674.497,10;32.674.497,10;
;0611.06.95;ΚΕΝΤΡΙΚΟΙ ΑΥΤΟΤΕΛΕΙΣ ΠΟΡΟΙ ΓΙΑ ΤΗΝ ΛΕΙΤΟΥΡΓΙΑ ΟΡΓΑΝΙΣΜΟY ΒΡΕΦΟΝΗΠΙΑΚΗΣ, ΠΑΙΔΙΚΗΣ ΚΑΙ ΟΙΚΟΓΕΝΕΙΑΚΗΣ ΜΕΡΙΜΝΑΣ (ΟΒΡΕΠΟΜ) ΔΗΜΟΥ ΘΕΣΣΑΛΟΝΙΚΗΣ;1.279.920,77;1.279.920,77;1.221.181,92;1.221.181,92;
;0612.01.95;ΚΕΝΤΡΙΚΟΙ ΑΥΤΟΤΕΛΕΙΣ ΠΟΡΟΙ ΓΙΑ ΚΑΛΥΨΗ ΔΑΠΑΝΩΝ ΚΑΤΑΒΟΛΗΣ ΜΙΣΘΩΜΑΤΩΝ ΤΩΝ ΚΤΙΡΙΩΝ ΤΩΝ ΚΕΠ, ΤΗΣ ΚΟΙΝΩΝΙΚΗΣ ΠΡΟΝΟΙΑΣ, ΤΗΣ Δ/ΝΣΗΣ ΔΟΜΗΣΗΣ ΚΑΙ ΠΟΛΕΟΔΟΜΙΚΩΝ ΕΦΑΡΜΟΓΩΝ ΚΑΙ ΛΟΙΠΩΝ ΜΕΤΑΦΕΡΟΜΕΝΩΝ ΑΡΜΟΔΙΟΤΗΤΩΝ;211.110,48;211.110,48;211.110,48;211.110,48;
;0612.02.95;ΚΕΝΤΡΙΚΟΙ ΑΥΤΟΤΕΛΕΙΣ ΠΟΡΟΙ ΓΙΑ ΚΑΛΥΨΗ ΔΑΠΑΝΩΝ ΚΑΤΑΒΟΛΗΣ ΜΙΣΘΩΜΑΤΩΝ ΣΧΟΛΙΚΩΝ ΚΤΙΡΙΩΝ;628.330,08;628.330,08;623.438,76;623.438,76;
;0614.01.95;ΕΣΟΔΑ ΓΙΑ ΤΙΣ ΛΕΙΤΟΥΡΓΙΚΕΣ ΔΑΠΑΝΕΣ ΤΩΝ ΣΧΟΛΕΙΩΝ;2.485.972,60;2.485.972,60;2.462.026,30;2.462.026,30;
;0619.06.01;ΑΠΟΔΟΣΗ ΠΑΡΑΚΡΑΤΗΘΕΝΤΩΝ ΠΟΡΩΝ Π.Ε. Ν.1828/89 (ΥΠ.ΕΣ.Α.Η.Δ.);5.656.623,84;5.656.623,84;2.010.045,17;2.010.045,17;
;0621.01.95;ΚΑΛΥΨΗ ΔΑΠΑΝΗΣ ΤΩΝ ΠΡΟΝΟΙΑΚΩΝ ΕΠΙΔΟΜΑΤΩΝ (άρθρ.94, παρ.3β, περ.17 και άρθρο 259 Ν.3852/2010);65.117.144,95;89.269.344,95;71.823.117,34;71.823.117,34;
;0713.01.01;ΕΣΟΔΑ ΑΠΟ ΠΑΡΑΒΟΛΑ ΕΚΔΟΣΗΣ ΑΔΕΙΩΝ ΛΕΙΤΟΥΡΓΙΑΣ ΚΑΤΑΣΤΗΜΑΤΩΝ ΥΓΕΙΟΝΟΜΙΚΟΥ ΕΝΔΙΑΦΕΡΟΝΤΟΣ;220.000,00;220.000,00;114.255,00;114.255,00;
;0713.02.01;ΕΣΟΔΑ ΑΠΟ ΠΑΡΑΒΟΛΑ ΑΔΕΙΩΝ ΧΡΗΣΗΣ ΜΟΥΣΙΚΗΣ ΚΑΤΑΣΤΗΜΑΤΩΝ ΥΓΕΙΟΝΟΜΙΚΟΥ ΕΝΔΙΑΦΕΡΟΝΤΟΣ;95.200,00;95.200,00;80.650,00;80.650,00;
;0715.01.01;ΕΣΟΔΟ ΕΙΔΙΚΟΥ ΛΟΓΑΡΙΑΣΜΟΥ Τ.Π.& Δ. ΑΠΟ ΤΟ 2% ΕΠΙ ΤΗΣ ΔΑΠΑΝΗΣ ΔΙΑΦΗΜΙΣΗΣ ΚΑΤΗΓΟΡΙΑΣ Δ';952.255,10;952.255,10;653.230,00;653.230,00;
;0718.05.01;ΠΑΡΑΒΟΛΑ ΓΙΑ ΤΗΝ ΕΚΔΟΣΗ ΑΔΕΙΑΣ ΙΔΡΥΣΗΣ & ΛΕΙΤΟΥΡΓΙΑΣ Μ.Φ.Π.Α.Δ;1.911,00;1.911,00;1.470,00;1.470,00;
;0718.08.01;ΠΑΡΑΒΟΛΑ ΓΙΑ ΤΗΝ ΕΚΔΟΣΗ ΑΔΕΙΑΣ ΙΔΡΥΣΗΣ & ΛΕΙΤΟΥΡΓΙΑΣ ΚΛΠ ΛΟΙΠΩΝ ΕΠΙΧΕΙΡΗΣΕΩΝ;10.000,00;61.885,00;61.885,00;61.885,00;
;0718.09.01;ΕΣΟΔΑ ΑΠΌ ΤΗΝ ΠΩΛΗΣΗ ΑΓΑΘΩΝ;121.500,00;121.500,00;35.288,76;35.288,76;
;1115.01.01;ΕΣΟΔΑ ΑΠΟ ΠΡΟΣΚΥΡΩΣΗ ΔΗΜΟΤΙΚΩΝ ΕΚΤΑΣΕΩΝ;20.000,00;75.024,71;75.024,71;75.024,71;
;1122.01.01;ΕΣΟΔΑ ΑΠΟ ΕΚΠΟΙΗΣΗ ΚΙΝΗΤΗΣ ΠΕΡΙΟΥΣΙΑΣ & ΥΛΙΚΩΝ;10.000,00;10.000,00;0,00;0,00;
;1212.15.01;ΕΠΙΧΟΡΗΓΗΣΗ ΕΥΡΩΠΑΙΚΟΥ ΠΡΟΓΡΑΜΜΑΤΟΣ URBACT II ''MY GENERATION AT WORK'';28.800,00;17.086,33;17.086,33;17.086,33;
;1214.01.01;ΕΠΙΧΟΡΗΓΗΣΗ ΓΙΑ ΔΡΑΣΕΙΣ ΠΟΛΙΤΙΚΗΣ ΠΡΟΣΤΑΣΙΑΣ ΠΟΥ ΠΡΟΟΡΙΖΟΝΤΑΙ ΓΙΑ ΛΕΙΤΟΥΡΓΙΚΕΣ ΔΑΠΑΝΕΣ;20.000,00;20.000,00;20.000,00;20.000,00;
;1219.02.01;ΕΠΙΧΟΡΗΓΗΣΗ ΑΠΟ ΟΑΕΔ ΓΙΑ ΠΡΟΓΡΑΜΜΑ ΚΑΤΑΡΤΙΣΗΣ ΛΑΕΚ (0,45%);197.807,50;197.807,50;197.807,50;197.807,50;
;1219.04.95;ΕΠΙΧΟΡΗΓΗΣΗ ΓΙΑ ΤΗΝ ΚΑΛΥΨΗ ΔΑΠΑΝΩΝ ΘΕΡΜΑΝΣΗΣ ΤΩΝ ΣΧΟΛΙΚΩΝ ΜΟΝΑΔΩΝ;990.000,00;990.000,00;0,00;0,00;
;1219.05.95;ΕΠΙΧΟΡΗΓΗΣΗ ΓΙΑ ΒΟΗΘΗΜΑΤΑ ΕΝΔΕΙΑΣ ΚΑΙ ΑΝΤΙΜΕΤΩΠΙΣΗ ΑΜΕΣΩΝ ΒΙΟΤΙΚΩΝ ΑΝΑΓΚΩΝ ΠΟΛΙΤΩΝ, ΛΟΓΩ ΦΥΣΙΚΩΝ ΚΑΤΑΣΤΡΟΦΩΝ;201.954,38;201.954,38;28.682,82;28.682,82;
;1311.01.01;ΕΣΟΔΑ ΑΠΟ ΚΑΠ ΕΠΕΝΔΥΤΙΚΩΝ ΔΑΠΑΝΩΝ ΓΙΑ ΧΡΗΜΑΤΟΔΟΤΗΣΗ ΕΡΓΩΝ;2.596.620,00;2.596.620,00;2.207.370,00;2.207.370,00;
;1312.01.01;ΕΣΟΔΑ ΑΠΟ ΚΑΠ ΕΠΕΝΔΥΤΙΚΩΝ ΔΑΠΑΝΩΝ ΓΙΑ ΣΥΝΤΗΡΗΣΗ & ΕΠΙΣΚΕΥΗ ΣΧΟΛΕΙΩΝ;476.500,00;476.500,00;476.500,00;476.500,00;
;1313.01.01;ΕΠΙΧΟΡΗΓΗΣΗ ΓΙΑ ΔΡΑΣΕΙΣ ΠΟΛΙΤΙΚΗΣ ΠΡΟΣΤΑΣΙΑΣ ΠΟΥ ΠΡΟΟΡΙΖΟΝΤΑΙ ΓΙΑ ΕΠΕΝΔΥΤΙΚΕΣ ΔΑΠΑΝΕΣ;50.600,00;50.600,00;50.600,00;50.600,00;
;1322.17.01;ΔΙΑΝΟΙΞΗ ΟΔΟΥ ΚΑΡΑΚΑΣΗ (ΑΠΟΖΗΜΙΩΣΗ ΓΙΑ ΠΛΑΤΕΙΑ ΚΑΟΥΔΗ) ΠΡΑΣΙΝΟ ΤΑΜΕΙΟ;3.934.800,00;3.934.800,00;0,00;0,00;
;1322.18.01;ΕΚΤΑΣΕΙΣ ΓΕΙΤΝΙΑΖΟΥΣΕΣ ΣΤΑ ΒΥΖΑΝΤΙΝΑ ΤΕΙΧΗ (ΠΛ. 12 ΑΠΟΣΤΟΛΩΝ, ΠΛΑΤΕΙΑ ΖΗΝΔΡΟΥ, ΟΔΟΣ ΑΚΡΙΤΑ) ΠΡΑΣΙΝΟ ΤΑΜΕΙΟ;173.750,00;173.750,00;0,00;0,00;
;1322.19.01;ΔΙΑΝΟΙΞΗ ΑΓΙΟΥ ΔΗΜΗΤΡΙΟΥ ΚΑΙ ΚΑΤΣΙΜΙΔΟΥ ΠΡΑΣΙΝΟ ΤΑΜΕΙΟ;3.837.000,00;3.837.000,00;0,00;0,00;
;1323.03.01;ΧΡΗΜΑΤΟΔΟΤΗΣΗ ΤΗΣ ΟΛΟΚΛΗΡΩΜΕΝΗΣ ΔΙΑΧΕΙΡΙΣΗΣ ΑΣΤΙΚΟΥ ΠΡΑΣΙΝΟΥ (INTEGRATED GREEN CITIES);636.792,47;636.792,47;5.592,45;5.592,45;
;1323.05.01;ΧΡΗΜΑΤΟΔΟΤΗΣΗ ΠΡΟΓΡΑΜΜΑΤΟΣ BLACK SEA BASIN 2007-2013 -ΟΛΟΚΛΗΡΩΜΕΝΗ ΠΑΡΑΚΟΛΟΥΘΗΣΗ ΤΩΝ ΠΕΡΙΒΑΛΛΟΝΤΙΚΩΝ ΠΡΟΒΛΗΜΑΤΩΝ ΤΩΝ ΑΚΤΩΝ ΣΕ ΘΑΛΑΣΣΙΕΣ ΠΕΡΙΟΧΕΣ ΚΑΙ ΤΡΟΠΟΙ ΑΝΤΙΜΕΤΩΠΙΣΗΣ ΤΟΥΣ-ICME, Ε.Ε.;456.405,41;456.405,41;330.677,36;330.677,36;
;1323.07.01;ΧΡΗΜΑΤΟΔΟΤΗΣΗ ΕΥΡΩΠΑΙΚΟΥ ΠΡΟΓΡΑΜΜΑΤΟΣ ''ΛΕΙΤΟΥΡΓΙΑ ΤΟΥ ΚΕΝΤΡΟΥ ΕΥΡΩΠΑΙΚΗΣ ΠΛΗΡΟΦΟΡΗΣΗΣ EUROPE DIRECT Δ.Θ.'', Ε.Ε.;25.000,00;32.500,00;25.000,00;25.000,00;
;1323.08.01;ΧΡΗΜΑΤΟΔΟΤΗΣΗ ΕΥΡΩΠΑΙΚΟΥ ΠΡΟΓΡΑΜΜΑΤΟΣ STORM ''ΑΝΑΠΤΥΞΗ ΥΠΗΡΕΣΙΩΝ ΕΞΥΠΝΩΝ ΠΟΛΕΩΝ ΜΕΣΩ ΤΕΧΝΟΛΟΓΙΩΝ CLOUD'', Ε.Ε.;22.773,33;22.773,33;0,00;0,00;
;1323.09.01;ΧΡΗΜΑΤΟΔΟΤΗΣΗ ΕΥΡΩΠΑΙΚΟΥ ΠΡΟΓΡΑΜΜΑΤΟΣ MEDSEATIES ''ΟΛΟΚΛΗΡΩΜΕΝΗ ΔΙΑΧΕΙΡΙΣΗ ΘΑΛΑΣΣΙΑΣ ΖΩΝΗΣ ΣΕ ΒΙΩΣΙΜΕΣ ΜΕΣΟΓΕΙΑΚΕΣ ΜΗΤΡΟΠΟΛΕΙΣ'', Ε.Ε.;66.929,79;71.700,20;0,00;0,00;
;1323.10.01;ΧΡΗΜΑΤΟΔΟΤΗΣΗ ΕΥΡΩΠΑΙΚΟΥ ΠΡΟΓΡΑΜΜΑΤΟΣ SKILLS BALANCING ''ΕΞΙΣΟΡΡΟΠΗΣΗ ΠΡΟΣΦΟΡΑΣ ΚΑΙ ΖΗΤΗΣΗΣ ΔΕΞΙΟΤΗΤΩΝ ΤΗΣ ΕΥΡΥΤΕΡΗΣ ΓΕΩΓΡΑΦΙΚΗΣ ΠΕΡΙΟΧΗΣ ΠΑΡΕΜΒΑΣΗΣ'', Ε.Ε.;177.429,92;177.429,92;37.429,92;37.429,92;
;1328.01.01;ΑΝΑΠΤΥΞΗ ΚΑΙ ΛΕΙΤΟΥΡΓΙΑ ΞΕΝΩΝΑ ΦΙΛΟΞΕΝΙΑΣ - ΕΣΠΑ;324.000,00;324.000,00;77.600,00;77.600,00;
;1328.03.01;ΕΝΑΡΜΟΝΗΣΗ ΟΙΚΟΓΕΝΕΙΑΚΗΣ ΚΑΙ ΕΠΑΓΓΕΛΜΑΤΙΚΗΣ ΖΩΗΣ ΕΣΠΑ;2.002.600,00;3.693.363,59;3.673.154,51;3.673.154,51;
;1328.04.01;ΠΡΟΜΗΘΕΙΑ ΕΞΟΠΛΙΣΜΟΥ ΕΙΔΙΚΩΝ ΣΧΟΛΕΙΩΝ Δ.Θ. - ΕΣΠΑ;364.484,68;364.484,68;0,00;0,00;
;1328.06.01;ΑΝΕΓΕΡΣΗ - ΕΞΟΠΛΙΣΜΟΣ ΚΤΙΡΙΟΥ ΚΟΙΝΩΝΙΚΗΣ ΠΡΟΝΟΙΑΣ ΓΙΑ ΤΗ ΛΕΙΤΟΥΡΓΙΑ ΔΗΜΟΤΙΚΩΝ ΙΑΤΡΕΙΩΝ ΣΤΗ ΔΗΜΟΤΙΚΗ ΚΟΙΝΟΤΗΤΑ ΤΡΙΑΝΔΡΙΑΣ Δ.Θ., ΕΣΠΑ;909.440,35;1.096.204,58;784.000,00;784.000,00;
;1328.07.01;ΠΡΟΣΘΗΚΗ ΚΑΤ' ΕΠΕΚΤΑΣΗ ΣΧΟΛΙΚΟΥ ΣΥΓΚΡΟΤΗΜΑΤΟΣ 4ου ΔΗΜΟΤΙΚΟΥ ΣΧΟΛΕΙΟΥ ΣΤΗΝ ΟΔΟ ΔΕΛΦΩΝ 150 ΕΣΠΑ;57.282,37;381.215,38;151.768,82;151.768,82;
;1328.08.01;ΠΡΟΣΘΗΚΗ ΚΑΤ' ΕΠΕΚΤΑΣΗ ΚΤΙΡΙΑΚΟΥ ΣΥΓΚΡΟΤΗΜΑΤΟΣ 5ου ΓΥΜΝΑΣΙΟΥ ΣΤΗΝ ΟΔΟ ΚΡΙΕΖΩΤΟΥ, ΕΣΠΑ;1.213.608,45;1.011.293,36;843.999,69;843.999,69;
;1328.09.01;ΑΠΟΚΑΤΑΣΤΑΣΗ Α' ΓΥΜΝΑΣΙΟΥ (ΠΑΡΑΡΤΗΜΑ) ΕΣΠΑ;406.450,23;689.304,94;660.493,38;660.493,38;
;1328.10.01;ΑΝΑΒΑΘΜΙΣΗ ΟΔΙΚΟΥ ΑΞΟΝΑ ΑΓΙΟΥ ΔΗΜΗΤΡΙΟΥ (Γ' ΦΑΣΗ) - ΤΜΗΜΑΤΑ Θ, Ι, Κ, Λ, Μ , ΕΣΠΑ;25.000,00;386.568,80;355.268,90;355.268,90;
;1328.11.01;ΑΝΑΠΛΑΣΗ ΝΕΑΣ ΠΑΡΑΛΙΑΣ (ΑΠΟ ΒΑΣΙΛΙΚΟ ΘΕΑΤΡΟ ΕΩΣ ΟΜΙΛΟΥΣ ΘΑΛΑΣΣΙΩΝ ΑΘΛΗΜΑΤΩΝ)  ΕΣΠΑ;578.263,17;777.615,68;243.930,82;243.930,82;
;1328.12.01;ΣΥΝΤΗΡΗΣΗ ΔΙΑΤΗΡΗΤΑΙΟΥ ΚΤΙΡΙΟΥ ΠΡΩΗΝ ΔΗΜΟΤΙΚΩΝ ΣΦΑΓΕΙΩΝ ΕΣΠΑ;22.027,16;115.000,00;115.000,00;115.000,00;
;1328.13.01;ΠΑΡΕΜΒΑΣΕΙΣ ΕΞΟΙΚΟΝΟΜΗΣΗΣ ΕΝΕΡΓΕΙΑΣ ΣΤΟ ΚΤΙΡΙΟ ΤΗΣ ΑΡΧΙΤΕΚΤΟΝΙΚΗΣ ΚΑΙ ΣΤΟ ΚΤΙΡΙΟ ΤΗΣ ΒΙΒΛΙΟΘΗΚΗΣ Δ.Θ. ‘’ΕΞΟΙΚΟΝΟΜΩ’’ ΕΣΠΑ;1.400.000,00;1.400.000,00;1.061.702,30;1.061.702,30;
;1328.14.01;ΠΑΡΕΜΒΑΣΕΙΣ ΕΞΟΙΚΟΝΟΜΗΣΗΣ ΕΝΕΡΓΕΙΑΣ ΣΤΟ ΔΗΜΑΡΧΕΙΟ ΤΡΙΑΝΔΡΙΑΣ (ΠΡΩΗΝ Δ. ΤΡΙΑΝΔΡΙΑΣ) & ΑΝΑΒΑΘΜΙΣΗ ΤΟΥ ΛΕΒΗΤΟΣΤΑΣΙΟΥ ΚΑΙ ΑΝΤΙΚΑΤΑΣΤΑΣΗ ΤΩΝ ΦΩΤΙΣΤΙΚΩΝ ΣΩΜΑΤΩΝ ΤΟΥ ΚΑΠΗ (ΠΡΩΗΝ Δ. ΤΡΙΑΝΔΡΙΑΣ) & ΤΟΠΟΘΕΤΗΣΗ ΣΚΙΑΣΤΡΩΝ ΚΑΙ ΑΝΑΒΑΘΜΙΣΗ ΤΟΥ ΛΕΒΗΤΟΣΤΑΣΙΟΥ ΣΤΟ ΚΕΝΤΡΟ ΝΕΟΤΗΤΑΣ ΤΡΙΑΝΔΡΙΑΣ ‘’ΕΞΟΙΚΟΝΟΜΩ’’ ΕΣΠΑ;419.259,45;419.259,45;0,00;0,00;
;1328.15.01;ΔΗΜΙΟΥΡΓΙΑ ΟΛΟΚΛΗΡΩΜΕΝΟΥ ΠΡΟΤΥΠΟΥ ΣΥΣΤΗΜΑΤΟΣ ΓΙΑ ΤΗΝ ΚΥΒΕΡΝΗΤΙΚΗ ΣΤΗ ΔΙΑΧΕΙΡΙΣΗ ΤΗΣ ΑΣΤΙΚΗΣ ΔΑΣΟΠΟΝΙΑΣ ΚΑΙ ΤΗΝ ΠΡΟΣΑΡΜΟΓΗ ΤΩΝ ΠΟΛΕΩΝ ΣΤΗΝ ΚΛΙΜΑΤΙΚΗ ΑΛΛΑΓΗ URBAN.FOR.MA.S, ΕΣΠΑ;15.000,00;15.000,00;9.000,00;9.000,00;
;1328.16.01;ΟΛΟΚΛΗΡΩΜΕΝΟ ΠΛΑΙΣΙΟ ΕΝΙΣΧΥΣΗΣ ΠΟΙΟΤΗΤΑΣ ΥΠΗΡΕΣΙΩΝ ΚΑΙ ΑΝΑΒΑΘΜΙΣΗΣ ΔΙΑΧΕΙΡΙΣΤΙΚΗΣ ΛΕΙΤΟΥΡΓΙΑΣ ΤΩΝ ΥΠΗΡΕΣΙΩΝ ΠΡΩΤΟΒΑΘΜΙΑΣ ΦΡΟΝΤΙΔΑΣ ΥΓΕΙΑΣ (ΠΦΥ) ΣΤΟ ΔΗΜΟ ΘΕΣΣΑΛΟΝΙΚΗΣ, ΕΣΠΑ;182.620,00;182.620,00;85.000,00;85.000,00;
;1328.17.01;ΧΡΗΜΑΤΟΔΟΤΗΣΗ ΓΙΑ ΤΗΝ ΥΛΟΠΟΙΗΣΗ ΤΩΝ ΠΡΟΓΡΑΜΜΑΤΩΝ ΤΟΠΙΚΑ ΣΧΕΔΙΑ ΑΠΑΣΧΟΛΗΣΗΣ - ΤΟΠ.Σ.Α., ΕΣΠΑ;48.323,67;47.166,17;28.121,40;28.121,40;
;1328.18.01;ΠΡΟΤΥΠΟ ΕΠΙΔΕΙΚΤΙΚΟ ΕΡΓΟ ΑΞΙΟΠΟΙΗΣΗΣ Α.Π.Ε. ΚΑΙ ΔΡΑΣΕΙΣ ΕΞΟΙΚΟΝΟΜΗΣΗΣ ΕΝΕΡΓΕΙΑΣ ΣΤΟ ΣΧΟΛΙΚΟ ΣΥΓΚΡΟΤΗΜΑ ΕΠΙ ΤΗΣ ΟΔΟΥ ΚΛΕΑΝΘΟΥΣ 30 ΚΑΤΩ ΤΟΥΜΠΑ ΔΘ, ΕΣΠΑ;140.081,51;180.081,51;94.857,51;94.857,51;
;1328.19.01;ΒΙΟΚΛΙΜΑΤΙΚΗ ΑΝΑΒΑΘΜΙΣΗ ΤΗΣ ΕΥΡΥΤΕΡΗΣ ΠΕΡΙΟΧΗΣ ΠΛΑΤΕΙΑΣ ΧΡΗΜΑΤΙΣΤΗΡΙΟΥ (ΠΕΡΙΚΛΕΙΟΜΕΝΗ ΠΕΡΙΟΧΗ: ΔΩΔΕΚΑΝΗΣΟΥ, ΤΣΙΜΙΣΚΗ, Ι. ΔΡΑΓΟΥΜΗ, ΕΓΝΑΤΙΑ), ΕΣΠΑ;2.504.422,58;2.529.588,59;2.110.264,97;2.110.264,97;
;1328.20.01;ΠΡΟΜΗΘΕΙΑ ΚΙΝΗΤΟΥ ΜΗΧΑΝΟΛΟΓΙΚΟΥ ΕΞΟΠΛΙΣΜΟΥ ΑΝΤΙΡΡΥΠΑΝΤΙΚΗΣ ΤΕΧΝΟΛΟΓΙΑΣ ΓΙΑ ΤΟΝ ΕΚΣΥΧΡΟΝΙΣΜΟ ΤΟΥ ΣΤΟΛΟΥ ΤΩΝ ΟΧΗΜΑΤΩΝ ΚΑΘΑΡΙΟΤΗΤΑΣ ΤΟΥ Δ.Θ., ΕΣΠΑ;15.384.594,00;15.384.594,00;10.061.000,00;10.061.000,00;
;1328.21.01;ΑΝΑΚΥΚΛΩΣΗ ΟΡΓΑΝΙΚΩΝ ΑΠΟΡΡΙΜΜΑΤΩΝ ΚΑΙ ΠΡΑΣΙΝΗ ΕΠΙΧΕΙΡΗΜΑΤΙΚΟΤΗΤΑ ΣΤΟΝ ΑΣΤΙΚΟ ΙΣΤΟ ΓΙΑ ΤΗΝ ΑΣΦΑΛΕΙΑ ΤΗΣ ΔΗΜΟΣΙΑΣ ΥΓΕΙΑΣ, ΕΣΠΑ;400.000,00;400.000,00;0,00;0,00;
;1328.22.01;ΧΡΗΜΑΤΟΔΟΤΗΣΗ ΓΙΑ ΤΗΝ ΕΠΕΚΤΑΣΗ ΚΑΙ ΑΝΑΒΑΘΜΙΣΗ ΤΟΥ ΥΦΙΣΤΑΜΕΝΟΥ Σ.Μ.Α. ΤΟΥ Δ.Θ., ΕΣΠΑ;1.700.000,00;1.700.000,00;1.109.000,00;1.109.000,00;
;1328.24.01;ΔΡΑΣΕΙΣ ΔΙΑΔΟΣΗΣ, ΔΙΚΤΥΩΣΗΣ ΚΑΙ ΕΝΗΜΕΡΩΣΗΣ ‘’ΕΞΟΙΚΟΝΟΜΩ’’ ΕΣΠΑ;63.000,00;63.000,00;0,00;0,00;
;1328.25.01;ΕΠΙΣΤΗΜΟΝΙΚΟΣ ΚΑΙ ΤΕΧΝΙΚΟΣ ΣΥΜΒΟΥΛΟΣ ΠΑΡΑΚΟΛΟΥΘΗΣΗΣ ΚΑΙ ΥΠΟΣΤΗΡΙΞΗΣ ΤΟΥ ΣΧΥ ΤΟΥ Δ.Θ. ΓΙΑ ΤΗΝ ΕΠΙΤΥΧΗ ΚΑΙ ΑΠΟΤΕΛΕΣΜΑΤΙΚΗ ΥΛΟΠΟΙΗΣΗ ΤΟΥ ‘’ΕΞΟΙΚΟΝΟΜΩ’’ ΕΣΠΑ;73.000,00;73.000,00;0,00;0,00;
;1328.26.01;ΕΝΕΡΓΕΙΕΣ ΔΙΑΔΟΣΗΣ, ΔΙΚΤΥΩΣΗΣ, ΕΝΗΜΕΡΩΣΗΣ ΠΡΟΓΡΑΜΜΑΤΟΣ ΕΞΟΙΚΟΝΟΜΩ (π. Δ. ΤΡΙΑΝΔΡΙΑΣ) ‘’ΕΞΟΙΚΟΝΟΜΩ’’ ΕΣΠΑ;21.000,00;21.000,00;0,00;0,00;
;1328.27.01;ΕΠΙΣΤΗΜΟΝΙΚΗ ΚΑΙ ΤΕΧΝΙΚΗ ΥΠΟΣΤΗΡΙΞΗ ΓΙΑ ΤΗΝ ΥΛΟΠΟΙΗΣΗ ΚΑΙ ΑΞΙΟΛΟΓΗΣΗ ΤΟΥ ΣΧΥ (π. Δ. ΤΡΙΑΝΔΡΙΑΣ) ΕΣΠΑ;2.361,60;2.361,60;0,00;0,00;
;1328.28.01;ΕΝΕΡΓΕΙΑΚΗ ΕΠΙΘΕΩΡΗΣΗ ΓΙΑ ΤΗΝ ΕΚΔΟΣΗ ΠΙΣΤΟΠΟΙΗΤΙΚΟΥ ΕΝΕΡΓΕΙΑΚΗΣ ΑΠΟΔΟΣΗΣ ΣΤΟ ΔΗΜΑΡΧΕΙΟ ΤΡΙΑΝΔΡΙΑΣ, ΣΤΟ ΚΑΠΗ ΚΑΙ ΣΤΟ ΚΕΝΤΡΟ ΝΕΟΤΗΤΑΣ ΠΡΩΗΝ Δ. ΤΡΙΑΝΔΡΙΑΣ, ΕΣΠΑ;12.000,00;12.000,00;0,00;0,00;
;1328.30.01;ΗΛΕΚΤΡΟΦΩΤΙΣΜΟΣ ΟΔΟΥ ΠΑΠΑΝΑΣΤΑΣΙΟΥ ΚΑΙ ΠΛΑΤΕΙΑΣ ΣΤΑΜΑΤΗ ΚΑΡΑΜΑΝΛΗ ΚΑΙ ΒΕΛΤΙΩΣΗ ΜΙΚΡΟΚΛΙΜΑΤΙΚΩΝ ΣΥΝΘΗΚΩΝ ΣΤΗΝ ΠΛΑΤΕΙΑ ΣΤΑΜΑΤΗ ΚΑΡΑΜΑΝΛΗ ‘’ΕΞΟΙΚΟΝΟΜΩ’’ ΕΣΠΑ;350.000,00;0,00;0,00;0,00;
;1328.33.01;ΑΝΤΙΚΑΤΑΣΤΑΣΗ ΛΑΜΠΤΗΡΩΝ ΚΑΙ ΕΓΚΑΤΑΣΤΑΣΗ ΣΥΣΤΗΜΑΤΟΣ ΕΝΕΡΓΕΙΑΚΗΣ ΠΑΡΑΚΟΛΟΥΘΗΣΗΣ ΚΑΙ ΕΛΕΓΧΟΥ ΤΟΥ ΕΞΩΤΕΡΙΚΟΥ ΦΩΤΙΣΜΟΥ ΣΕ 9 ΚΕΝΤΡΙΚΟΥΣ ΑΞΟΝΕΣ ΤΟΥ π. Δ. ΤΡΙΑΝΔΡΙΑΣ ‘’ΕΞΟΙΚΟΝΟΜΩ’’ ΕΣΠΑ;100.000,00;100.000,00;0,00;0,00;
;1328.34.01;ΕΦΑΡΜΟΓΗ ΕΙΔΙΚΩΝ ΛΩΡΙΔΩΝ ΛΕΩΦΟΡΕΙΩΝ ΣΤΗ ΘΕΣΣΑΛΟΝΙΚΗ ΣΤΙΣ ΟΔΟΥΣ Γ.ΠΑΠΑΝΔΡΕΟΥ, ΑΓΓΕΛΑΚΗ, ΑΛ.ΠΑΠΑΝΑΣΤΑΣΙΟΥ ΚΑΙ ΣΤΗ ΛΕΩΦΟΡΟ ΣΤΡΑΤΟΥ, ΕΣΠΑ;18.000,00;18.000,00;0,00;0,00;
;1328.35.01;ΧΡΗΜΑΤΟΔΟΤΗΣΗ ΓΙΑ ΤΗΝ ΕΝΙΣΧΥΣΗ ΤΗΣ ΔΙΑΧΕΙΡΙΣΤΙΚΗΣ ΙΚΑΝΟΤΗΤΑΣ ΤΩΝ ΔΗΜΟΤΙΚΩΝ ΥΠΗΡΕΣΙΩΝ, ΕΣΠΑ;29.000,00;48.867,90;48.867,90;48.867,90;
;1328.38.01;ΣΥΜΒΟΥΛΟΣ ΕΞΩΤΕΡΙΚΗΣ ΑΞΙΟΛΟΓΗΣΗΣ ΤΗΣ ΕΠΙΤΕΥΞΗΣ ΤΩΝ ΣΤΟΧΩΝ ΤΟΥ ΣΧΥ ΤΟΥ Δ.Θ., ΕΣΠΑ;23.500,00;23.500,00;0,00;0,00;
